{
  "$schema": "https://json-schema.org/draft/2020-12/schema",
  "$id": "https://doximity.com/bedside-bench/schemas/case.f1_weighted_rubric.schema.json",
  "title": "F1-weighted-rubric case",
  "description": "A single evaluation case graded by f1_weighted_rubric over free-text management-plan action items. Each rubric item is one candidate action; its signed `points` encode both direction and severity and map to a 1–9 class (+3→9, +2→8, +1→7, 0→5, −1→3, −2→2, −3→1) before weighted precision/recall (weights 72/24/3/1). Appropriate actions are positive (+1 mild, +2 moderate, +3 severe importance-to-include), inappropriate actions are negative (−1 mild, −2 moderate, −3 severe harm-if-taken), and equivocal actions are 0.",
  "type": "object",
  "additionalProperties": false,
  "required": [
    "case_id",
    "benchmark",
    "grading_method",
    "prompt",
    "rubric_items",
    "split"
  ],
  "properties": {
    "case_id": { "type": "string", "minLength": 1 },
    "benchmark": { "type": "string", "minLength": 1 },
    "grading_method": { "const": "f1_weighted_rubric" },
    "prompt": { "type": "string", "minLength": 1 },
    "split": { "type": "string", "enum": ["train", "test"] },
    "rubric_items": {
      "type": "array",
      "minItems": 1,
      "items": {
        "type": "object",
        "additionalProperties": false,
        "required": ["item_id", "text", "points"],
        "properties": {
          "item_id": { "type": "string", "minLength": 1 },
          "text": { "type": "string", "minLength": 1 },
          "points": { "type": "integer", "minimum": -3, "maximum": 3 }
        }
      }
    }
  }
}
