{
  "case_id": "74c61cbb13e0e72a59b7ff659ec02716",
  "benchmark": "safety_therapeutic",
  "grading_method": "f1_weighted_rubric",
  "prompt": "59 year old patient has been on valproate for many years. He drinks 8 cups of water per day and has edema, hypertension, and hyponatremia. Urine lytes are consistent with SIADH, with a urine osmolality of 540 mOsm/kg. Would it be appropriate to start this patient on furosemide for SIADH?\n\nProvide a stepwise therapeutic management plan including medications, counseling, and follow-up.",
  "rubric_items": [
    {
      "item_id": "898d8cde7a5a0f3f9b7fe98c8ceb3915_0",
      "text": "Initiate fluid restriction to approximately 800-1000 mL per day as first-line therapy.",
      "points": 2
    },
    {
      "item_id": "898d8cde7a5a0f3f9b7fe98c8ceb3915_1",
      "text": "Check the serum sodium urgently to quantify the severity of hyponatremia.",
      "points": 2
    },
    {
      "item_id": "898d8cde7a5a0f3f9b7fe98c8ceb3915_2",
      "text": "Confirm hypotonic hyponatremia with a measured serum osmolality.",
      "points": 2
    },
    {
      "item_id": "898d8cde7a5a0f3f9b7fe98c8ceb3915_3",
      "text": "Obtain a basic metabolic panel including BUN and creatinine.",
      "points": 2
    },
    {
      "item_id": "898d8cde7a5a0f3f9b7fe98c8ceb3915_4",
      "text": "Repeat paired serum and urine osmolality with urine sodium to confirm persistent SIADH physiology.",
      "points": 1
    },
    {
      "item_id": "898d8cde7a5a0f3f9b7fe98c8ceb3915_5",
      "text": "Assess the patient's clinical volume status before selecting diuretic therapy.",
      "points": 1
    },
    {
      "item_id": "898d8cde7a5a0f3f9b7fe98c8ceb3915_6",
      "text": "Review all current medications for agents that can cause or worsen SIADH.",
      "points": 2
    },
    {
      "item_id": "898d8cde7a5a0f3f9b7fe98c8ceb3915_7",
      "text": "Arrange supervised tapering or discontinuation of valproate if it is considered the likely cause of SIADH.",
      "points": 2
    },
    {
      "item_id": "898d8cde7a5a0f3f9b7fe98c8ceb3915_8",
      "text": "Consult the valproate-prescribing specialist to select an alternative antiepileptic or mood-stabilizing therapy.",
      "points": 1
    },
    {
      "item_id": "898d8cde7a5a0f3f9b7fe98c8ceb3915_9",
      "text": "Order TSH to exclude hypothyroidism.",
      "points": 1
    },
    {
      "item_id": "898d8cde7a5a0f3f9b7fe98c8ceb3915_10",
      "text": "Order a morning serum cortisol to exclude adrenal insufficiency.",
      "points": 1
    },
    {
      "item_id": "898d8cde7a5a0f3f9b7fe98c8ceb3915_11",
      "text": "Check NT-proBNP when heart failure is a plausible explanation for the edema and hyponatremia.",
      "points": 1
    },
    {
      "item_id": "898d8cde7a5a0f3f9b7fe98c8ceb3915_12",
      "text": "Obtain a transthoracic echocardiogram when the clinical assessment suggests cardiac dysfunction.",
      "points": 1
    },
    {
      "item_id": "898d8cde7a5a0f3f9b7fe98c8ceb3915_13",
      "text": "Instruct the patient to monitor daily body weight.",
      "points": 1
    },
    {
      "item_id": "898d8cde7a5a0f3f9b7fe98c8ceb3915_14",
      "text": "For mild, stable hyponatremia appropriate for outpatient care, recheck sodium within one week and sooner, typically within 24–72 hours, after medication changes or when correction risk is higher.",
      "points": 2
    },
    {
      "item_id": "898d8cde7a5a0f3f9b7fe98c8ceb3915_15",
      "text": "During inpatient active correction of moderate or profound hyponatremia, monitor serum sodium approximately every 4–6 hours, with more frequent checks during hypertonic saline boluses, brisk aquaresis, or impending overcorrection.",
      "points": 2
    },
    {
      "item_id": "898d8cde7a5a0f3f9b7fe98c8ceb3915_16",
      "text": "Limit the rate of sodium correction using guideline-concordant ceilings (no more than 8 mEq/L per 24 hours, or up to 10 mEq/L in the first 24 hours then 8 mEq/L per 24 hours for standard-risk patients; no more than 8 mEq/L in any 24 hours if at high risk of osmotic demyelination).",
      "points": 3
    },
    {
      "item_id": "898d8cde7a5a0f3f9b7fe98c8ceb3915_17",
      "text": "Counsel the patient to seek urgent care for confusion, seizure, severe headache, or other major neurologic symptoms.",
      "points": 1
    },
    {
      "item_id": "898d8cde7a5a0f3f9b7fe98c8ceb3915_18",
      "text": "Refer to nephrology for persistent, refractory, or diagnostically uncertain hyponatremia.",
      "points": 1
    },
    {
      "item_id": "898d8cde7a5a0f3f9b7fe98c8ceb3915_19",
      "text": "For selected patients with confirmed euvolemic SIADH refractory to first-line measures, consider low-dose furosemide plus oral sodium chloride under specialist oversight, with close monitoring of sodium, potassium, renal function, and congestion.",
      "points": 1
    },
    {
      "item_id": "898d8cde7a5a0f3f9b7fe98c8ceb3915_20",
      "text": "Use oral urea for chronic SIADH that remains refractory to fluid restriction and removal of the offending medication.",
      "points": 1
    },
    {
      "item_id": "898d8cde7a5a0f3f9b7fe98c8ceb3915_21",
      "text": "Administer carefully monitored 3% hypertonic saline for severe neurologic symptoms attributable to hyponatremia.",
      "points": 2
    },
    {
      "item_id": "898d8cde7a5a0f3f9b7fe98c8ceb3915_22",
      "text": "Start furosemide as monotherapy for presumed SIADH.",
      "points": -1
    },
    {
      "item_id": "898d8cde7a5a0f3f9b7fe98c8ceb3915_23",
      "text": "Start furosemide before evaluating the etiology and volume status of the hyponatremia.",
      "points": -2
    },
    {
      "item_id": "898d8cde7a5a0f3f9b7fe98c8ceb3915_24",
      "text": "Administer high-dose loop diuretic therapy for this hyponatremia without close monitoring.",
      "points": -2
    },
    {
      "item_id": "898d8cde7a5a0f3f9b7fe98c8ceb3915_25",
      "text": "Initiate a thiazide diuretic for hypertension in the setting of hyponatremia.",
      "points": -2
    },
    {
      "item_id": "898d8cde7a5a0f3f9b7fe98c8ceb3915_26",
      "text": "Advise unrestricted or increased free-water intake.",
      "points": -2
    },
    {
      "item_id": "898d8cde7a5a0f3f9b7fe98c8ceb3915_27",
      "text": "Administer hypotonic intravenous fluids as routine treatment of ongoing hyponatremia, outside a monitored rescue protocol to prevent or reverse sodium overcorrection.",
      "points": -3
    },
    {
      "item_id": "898d8cde7a5a0f3f9b7fe98c8ceb3915_28",
      "text": "Attempt rapid sodium correction exceeding 10 mEq/L in 24 hours.",
      "points": -3
    },
    {
      "item_id": "898d8cde7a5a0f3f9b7fe98c8ceb3915_29",
      "text": "Administer routine hypertonic saline for stable, chronic, mild hyponatremia without significant attributable symptoms or another urgent indication.",
      "points": -2
    },
    {
      "item_id": "898d8cde7a5a0f3f9b7fe98c8ceb3915_30",
      "text": "Administer 3% hypertonic saline in an outpatient clinic.",
      "points": -2
    },
    {
      "item_id": "898d8cde7a5a0f3f9b7fe98c8ceb3915_31",
      "text": "Prescribe desmopressin as routine treatment for SIADH.",
      "points": -2
    },
    {
      "item_id": "898d8cde7a5a0f3f9b7fe98c8ceb3915_32",
      "text": "Abruptly stop long-term valproate without a safe transition plan.",
      "points": -2
    },
    {
      "item_id": "898d8cde7a5a0f3f9b7fe98c8ceb3915_33",
      "text": "Continue valproate indefinitely without reassessing its contribution to SIADH.",
      "points": -2
    },
    {
      "item_id": "898d8cde7a5a0f3f9b7fe98c8ceb3915_34",
      "text": "Initiate or reinitiate tolvaptan for hyponatremia outside a hospital setting.",
      "points": -2
    },
    {
      "item_id": "898d8cde7a5a0f3f9b7fe98c8ceb3915_35",
      "text": "Use demeclocycline as first-line therapy before fluid restriction and medication review.",
      "points": -1
    },
    {
      "item_id": "898d8cde7a5a0f3f9b7fe98c8ceb3915_36",
      "text": "Discharge the patient on salt tablets without arranging follow-up sodium monitoring.",
      "points": -2
    },
    {
      "item_id": "898d8cde7a5a0f3f9b7fe98c8ceb3915_37",
      "text": "Use emergent hemodialysis solely to correct stable chronic SIADH-associated hyponatremia.",
      "points": -3
    },
    {
      "item_id": "898d8cde7a5a0f3f9b7fe98c8ceb3915_38",
      "text": "If evaluation establishes hypervolemic hyponatremia with congestion, use loop diuresis when indicated and treat the underlying cause rather than managing the patient as having SIADH.",
      "points": 2
    }
  ],
  "split": "train"
}
